38,12,They send someone down here every 10 years or so.
30,18,I wonder if I'll see James down here. Been a while since I saw him.
6,29,Don't worry you don't have to be alone any more.
34,3,Hello? Is this thing on?!?!?
27,45,I can't remember exactly why I'm here
54,30,Is it just me or do all of these walls look the same.
32,45,I just wanted to be a time traveller.
23,46,Would I be able to tell if I was inside a video game?
1,47,Do you think it'd be OK if I just randomly started quoting song lyrics?
